{"authority_package_digest":"38679b367d9851245ed84ff2e813b0527260dee71a052278c2cd7fb9e58d19a1","campaign_id":"m5.census-0.1","m3_analysis_manifest_sha256":"f69cd3890de54278c231bb6bd8fb0125a31903c2b01d85c81ad1e5d732f9276f","m4_requirement_set_digest":"04b2d279cec33b44ecbaa5b4531142a8c25d879b36079f87349e3314528a10dc","record_file_descriptors":[{"byte_length":2310,"record_count":1,"relative_path":"capability-definitions.jsonl","sha256":"8c9593a28fbf6cdb747277adcdd216c6125903f7a9c5a40934114fe7f0c7f1c0"},{"byte_length":0,"record_count":0,"relative_path":"capability-relations.jsonl","sha256":"e3b0c44298fc1c149afbf4c8996fb92427ae41e4649b934ca495991b7852b855"},{"byte_length":0,"record_count":0,"relative_path":"evolution.jsonl","sha256":"e3b0c44298fc1c149afbf4c8996fb92427ae41e4649b934ca495991b7852b855"},{"byte_length":7195,"record_count":5,"relative_path":"links.jsonl","sha256":"d2e6b7777c12b9666b90b4f21a015de997886d6de1f80e760922f1d3caca7fd0"},{"byte_length":2515,"record_count":5,"relative_path":"mapping-decisions.jsonl","sha256":"bb845099d757189000b7eeb13779070ef3e08d7ce9b1ab408bfedc865fc660ed"},{"byte_length":4150,"record_count":5,"relative_path":"requirement-admissibility.jsonl","sha256":"0c16d323224f0c7593dc6245a46fd7140a851e3595cb32996f91c5ba40b6e200"},{"byte_length":3398,"record_count":6,"relative_path":"review-authority.jsonl","sha256":"9d6d985605ef6411f6cc9f4c9c7bad3693fc720fb299e61de3508e3a3abb753e"}],"review_policy":{"capability_review_authority_id":"m4.capability-review","capability_review_authority_version":"1","capability_reviewer_id":"maintainer:chris","mapping_multiplicity":"ONE_PER_SELECTED_REQUIREMENT","sra_authority_id":"m4.source-requirement-admissibility","sra_authority_version":"1","sra_multiplicity":"EXACTLY_ONE_PER_SELECTED_REQUIREMENT","sra_reviewer_id":"maintainer:chris"},"schema":"census.m5-m4-authority-package.v1","selected_requirement_ids":["srq_032bf908454b79e8b509ec8987a8e987082a3fa8d513fa80386a99e4a07cb7a1","srq_166cd88fecd1d464c50b588f472789465e3a9eec32706924b82010aded4790f0","srq_32d5c97105a65b6e5104e6593ee158f8008a5fc056e5cbbc67551d0bd64c13d4","srq_9621417689e289d3df41374fe26f5d8c34f275326fcba1f42b73421400e6b1e5","srq_ac4e8102c3e6b089bce9527dd0c2c8ebfd93cce4ea1da0b590e50d9c314a822e"]}